16:05:25.672626 IP 192.168.10.145.6633 > 192.168.10.152.49850: Flags [P.], seq 185244632:185244652, ack 1110527050, win 1452, options [nop,nop,TS val 252379331 ecr 16093063], length 20: OpenFlow
	version 1.0, type STATS_REQUEST, length 20, xid 0x0006a8ff
16:05:25.672680 IP 192.168.10.152.49850 > 192.168.10.145.6633: Flags [.], ack 20, win 361, options [nop,nop,TS val 16093594 ecr 252379331], length 0
16:05:25.672830 IP 192.168.10.152.49850 > 192.168.10.145.6633: Flags [P.], seq 1:13, ack 20, win 361, options [nop,nop,TS val 16093594 ecr 252379331], length 12: OpenFlow
	version 1.0, type STATS_REPLY, length 12, xid 0x0006a8ff
16:05:25.673828 IP 192.168.10.145.6633 > 192.168.10.152.49850: Flags [P.], seq 20:32, ack 13, win 1452, options [nop,nop,TS val 252379331 ecr 16093594], length 12: OpenFlow
	version 1.0, type STATS_REQUEST, length 12, xid 0x0006a900
16:05:25.674000 IP 192.168.10.152.49850 > 192.168.10.145.6633: Flags [.], seq 13:2909, ack 32, win 361, options [nop,nop,TS val 16093595 ecr 252379331], length 2896: OpenFlow
	version 1.0, type STATS_REPLY, length 16268, xid 0x0006a900 [|openflow]
16:05:25.674029 IP 192.168.10.152.49850 > 192.168.10.145.6633: Flags [.], seq 2909:5805, ack 32, win 361, options [nop,nop,TS val 16093595 ecr 252379331], length 2896: OpenFlow
	version unknown (0x74), type 0x61, length 25196, xid 0x65343500 [|openflow]
16:05:25.674042 IP 192.168.10.152.49850 > 192.168.10.145.6633: Flags [.], seq 5805:8701, ack 32, win 361, options [nop,nop,TS val 16093595 ecr 252379331], length 2896: OpenFlow
	version unknown (0x00), type 0x00, length 0, xid 0x00000000 (corrupt)
16:05:25.674047 IP 192.168.10.152.49850 > 192.168.10.145.6633: Flags [.], seq 8701:11597, ack 32, win 361, options [nop,nop,TS val 16093595 ecr 252379331], length 2896: OpenFlow
	version unknown (0x00), type 0x3f, length 65535, xid 0x000f4240 [|openflow]
16:05:25.674059 IP 192.168.10.152.49850 > 192.168.10.145.6633: Flags [.], seq 11597:14493, ack 32, win 361, options [nop,nop,TS val 16093595 ecr 252379331], length 2896: OpenFlow
	version unknown (0x00), type 0x00, length 0, xid 0x00000000 (corrupt)
16:05:25.674135 IP 192.168.10.145.6633 > 192.168.10.152.49850: Flags [.], ack 11597, win 1452, options [nop,nop,TS val 252379331 ecr 16093595], length 0
16:05:25.674154 IP 192.168.10.152.49850 > 192.168.10.145.6633: Flags [.], seq 14493:15941, ack 32, win 361, options [nop,nop,TS val 16093595 ecr 252379331], length 1448: OpenFlow
	version unknown (0x74), type 0x61, length 25196, xid 0x65323236 [|openflow]
16:05:25.674168 IP 192.168.10.152.49850 > 192.168.10.145.6633: Flags [P.], seq 15941:16281, ack 32, win 361, options [nop,nop,TS val 16093595 ecr 252379331], length 340: OpenFlow
	version unknown (0x00), type 0x00, length 0, xid 0x00000000 (corrupt)
16:05:25.674220 IP 192.168.10.145.6633 > 192.168.10.152.49850: Flags [.], ack 15941, win 1452, options [nop,nop,TS val 252379331 ecr 16093595], length 0
16:05:25.684257 IP 192.168.10.145.6633 > 192.168.10.152.49850: Flags [P.], seq 32:88, ack 16281, win 1452, options [nop,nop,TS val 252379334 ecr 16093595], length 56: OpenFlow
	version 1.0, type STATS_REQUEST, length 56, xid 0x0006a901
16:05:25.684449 IP 192.168.10.152.49850 > 192.168.10.145.6633: Flags [P.], seq 16281:16685, ack 88, win 361, options [nop,nop,TS val 16093597 ecr 252379334], length 404: OpenFlow
	version 1.0, type STATS_REPLY, length 404, xid 0x0006a901
16:05:25.689087 IP 192.168.10.145.6633 > 192.168.10.152.49850: Flags [.], seq 88:1536, ack 16685, win 1452, options [nop,nop,TS val 252379335 ecr 16093597], length 1448: OpenFlow
	version 1.0, type STATS_REQUEST, length 56, xid 0x0006a902
	version 1.0, type STATS_REQUEST, length 56, xid 0x0006a903
	version 1.0, type STATS_REQUEST, length 56, xid 0x0006a904
	version 1.0, type STATS_REQUEST, length 56, xid 0x0006a905
	version 1.0, type STATS_REQUEST, length 56, xid 0x0006a906
	version 1.0, type STATS_REQUEST, length 56, xid 0x0006a907
	version 1.0, type STATS_REQUEST, length 56, xid 0x0006a908
	version 1.0, type STATS_REQUEST, length 56, xid 0x0006a909
	version 1.0, type STATS_REQUEST, length 56, xid 0x0006a90a
	version 1.0, type STATS_REQUEST, length 56, xid 0x0006a90b
	version 1.0, type STATS_REQUEST, length 56, xid 0x0006a90c
	version 1.0, type STATS_REQUEST, length 56, xid 0x0006a90d
	version 1.0, type STATS_REQUEST, length 56, xid 0x0006a90e
	version 1.0, type STATS_REQUEST, length 56, xid 0x0006a90f
	version 1.0, type STATS_REQUEST, length 56, xid 0x0006a910
	version 1.0, type STATS_REQUEST, length 56, xid 0x0006a911
	version 1.0, type STATS_REQUEST, length 56, xid 0x0006a912
	version 1.0, type STATS_REQUEST, length 56, xid 0x0006a913
	version 1.0, type STATS_REQUEST, length 56, xid 0x0006a914
	version 1.0, type STATS_REQUEST, length 56, xid 0x0006a915
	version 1.0, type STATS_REQUEST, length 56, xid 0x0006a916
	version 1.0, type STATS_REQUEST, length 56, xid 0x0006a917
	version 1.0, type STATS_REQUEST, length 56, xid 0x0006a918
	version 1.0, type STATS_REQUEST, length 56, xid 0x0006a919
	version 1.0, type STATS_REQUEST, length 56, xid 0x0006a91a
	version 1.0, type STATS_REQUEST, length 56, xid 0x0006a91b [|openflow]
16:05:25.689107 IP 192.168.10.145.6633 > 192.168.10.152.49850: Flags [P.], seq 1536:1768, ack 16685, win 1452, options [nop,nop,TS val 252379335 ecr 16093597], length 232: OpenFlow
	version unknown (0x00), type 0x00, length 0, xid 0x1900ffff (corrupt)
16:05:25.689150 IP 192.168.10.152.49850 > 192.168.10.145.6633: Flags [P.], seq 16685:16721, ack 1768, win 360, options [nop,nop,TS val 16093598 ecr 252379335], length 36: OpenFlow
	version 1.0, type STATS_REPLY, length 36, xid 0x0006a902
16:05:25.689186 IP 192.168.10.152.49850 > 192.168.10.145.6633: Flags [P.], seq 16721:16757, ack 1768, win 360, options [nop,nop,TS val 16093598 ecr 252379335], length 36: OpenFlow
	version 1.0, type STATS_REPLY, length 36, xid 0x0006a903
16:05:25.689209 IP 192.168.10.152.49850 > 192.168.10.145.6633: Flags [P.], seq 16757:16793, ack 1768, win 360, options [nop,nop,TS val 16093598 ecr 252379335], length 36: OpenFlow
	version 1.0, type STATS_REPLY, length 36, xid 0x0006a904
16:05:25.689231 IP 192.168.10.152.49850 > 192.168.10.145.6633: Flags [P.], seq 16793:16829, ack 1768, win 360, options [nop,nop,TS val 16093598 ecr 252379335], length 36: OpenFlow
	version 1.0, type STATS_REPLY, length 36, xid 0x0006a905
16:05:25.689252 IP 192.168.10.152.49850 > 192.168.10.145.6633: Flags [P.], seq 16829:16865, ack 1768, win 360, options [nop,nop,TS val 16093598 ecr 252379335], length 36: OpenFlow
	version 1.0, type STATS_REPLY, length 36, xid 0x0006a906
16:05:25.689273 IP 192.168.10.152.49850 > 192.168.10.145.6633: Flags [P.], seq 16865:16901, ack 1768, win 360, options [nop,nop,TS val 16093598 ecr 252379335], length 36: OpenFlow
	version 1.0, type STATS_REPLY, length 36, xid 0x0006a907
16:05:25.689293 IP 192.168.10.152.49850 > 192.168.10.145.6633: Flags [P.], seq 16901:16937, ack 1768, win 360, options [nop,nop,TS val 16093598 ecr 252379335], length 36: OpenFlow
	version 1.0, type STATS_REPLY, length 36, xid 0x0006a908
16:05:25.689314 IP 192.168.10.152.49850 > 192.168.10.145.6633: Flags [P.], seq 16937:16973, ack 1768, win 360, options [nop,nop,TS val 16093598 ecr 252379335], length 36: OpenFlow
	version 1.0, type STATS_REPLY, length 36, xid 0x0006a909
16:05:25.689334 IP 192.168.10.145.6633 > 192.168.10.152.49850: Flags [.], seq 1768:3216, ack 16685, win 1452, options [nop,nop,TS val 252379335 ecr 16093597], length 1448: OpenFlow
	version 1.0, type STATS_REQUEST, length 56, xid 0x0006a920
	version 1.0, type STATS_REQUEST, length 56, xid 0x0006a921
	version 1.0, type STATS_REQUEST, length 56, xid 0x0006a922
	version 1.0, type STATS_REQUEST, length 56, xid 0x0006a923
	version 1.0, type STATS_REQUEST, length 56, xid 0x0006a924
	version 1.0, type STATS_REQUEST, length 56, xid 0x0006a925
	version 1.0, type STATS_REQUEST, length 56, xid 0x0006a926
	version 1.0, type STATS_REQUEST, length 56, xid 0x0006a927
	version 1.0, type STATS_REQUEST, length 56, xid 0x0006a928
	version 1.0, type STATS_REQUEST, length 56, xid 0x0006a929
	version 1.0, type STATS_REQUEST, length 56, xid 0x0006a92a
	version 1.0, type STATS_REQUEST, length 56, xid 0x0006a92b
	version 1.0, type STATS_REQUEST, length 56, xid 0x0006a92c
	version 1.0, type STATS_REQUEST, length 56, xid 0x0006a92d
	version 1.0, type STATS_REQUEST, length 56, xid 0x0006a92e
	version 1.0, type STATS_REQUEST, length 56, xid 0x0006a92f
	version 1.0, type STATS_REQUEST, length 56, xid 0x0006a930
	version 1.0, type STATS_REQUEST, length 56, xid 0x0006a931
	version 1.0, type STATS_REQUEST, length 56, xid 0x0006a932
	version 1.0, type STATS_REQUEST, length 56, xid 0x0006a933
	version 1.0, type STATS_REQUEST, length 56, xid 0x0006a934
	version 1.0, type STATS_REQUEST, length 56, xid 0x0006a935
	version 1.0, type STATS_REQUEST, length 56, xid 0x0006a936
	version 1.0, type STATS_REQUEST, length 56, xid 0x0006a937
	version 1.0, type STATS_REQUEST, length 56, xid 0x0006a938
	version 1.0, type STATS_REQUEST, length 56, xid 0x0006a939 [|openflow]
16:05:25.689341 IP 192.168.10.152.49850 > 192.168.10.145.6633: Flags [P.], seq 16973:17009, ack 1768, win 360, options [nop,nop,TS val 16093598 ecr 252379335], length 36: OpenFlow
	version 1.0, type STATS_REPLY, length 36, xid 0x0006a90a
16:05:25.689341 IP 192.168.10.145.6633 > 192.168.10.152.49850: Flags [P.], seq 3216:4232, ack 16685, win 1452, options [nop,nop,TS val 252379335 ecr 16093597], length 1016: OpenFlow
	version unknown (0x00), type 0x00, length 0, xid 0x3700ffff (corrupt)
16:05:25.689406 IP 192.168.10.152.49850 > 192.168.10.145.6633: Flags [P.], seq 17009:17045, ack 4232, win 356, options [nop,nop,TS val 16093599 ecr 252379335], length 36: OpenFlow
	version 1.0, type STATS_REPLY, length 36, xid 0x0006a90b
16:05:25.689427 IP 192.168.10.152.49850 > 192.168.10.145.6633: Flags [P.], seq 17045:17081, ack 4232, win 356, options [nop,nop,TS val 16093599 ecr 252379335], length 36: OpenFlow
	version 1.0, type STATS_REPLY, length 36, xid 0x0006a90c
16:05:25.689437 IP 192.168.10.152.49850 > 192.168.10.145.6633: Flags [P.], seq 17081:17117, ack 4232, win 356, options [nop,nop,TS val 16093599 ecr 252379335], length 36: OpenFlow
	version 1.0, type STATS_REPLY, length 36, xid 0x0006a90d
16:05:25.689451 IP 192.168.10.152.49850 > 192.168.10.145.6633: Flags [P.], seq 17117:17153, ack 4232, win 356, options [nop,nop,TS val 16093599 ecr 252379335], length 36: OpenFlow
	version 1.0, type STATS_REPLY, length 36, xid 0x0006a90e
16:05:25.689462 IP 192.168.10.152.49850 > 192.168.10.145.6633: Flags [P.], seq 17153:17189, ack 4232, win 356, options [nop,nop,TS val 16093599 ecr 252379335], length 36: OpenFlow
	version 1.0, type STATS_REPLY, length 36, xid 0x0006a90f
16:05:25.689628 IP 192.168.10.145.6633 > 192.168.10.152.49850: Flags [.], seq 4232:5680, ack 17189, win 1452, options [nop,nop,TS val 252379335 ecr 16093598], length 1448: OpenFlow
	version 1.0, type STATS_REQUEST, length 56, xid 0x0006a94c
	version 1.0, type STATS_REQUEST, length 56, xid 0x0006a94d
	version 1.0, type STATS_REQUEST, length 56, xid 0x0006a94e
	version 1.0, type STATS_REQUEST, length 56, xid 0x0006a94f
	version 1.0, type STATS_REQUEST, length 56, xid 0x0006a950
	version 1.0, type STATS_REQUEST, length 56, xid 0x0006a951
	version 1.0, type STATS_REQUEST, length 56, xid 0x0006a952
	version 1.0, type STATS_REQUEST, length 56, xid 0x0006a953
	version 1.0, type STATS_REQUEST, length 56, xid 0x0006a954
	version 1.0, type STATS_REQUEST, length 56, xid 0x0006a955
	version 1.0, type STATS_REQUEST, length 56, xid 0x0006a956
	version 1.0, type STATS_REQUEST, length 56, xid 0x0006a957
	version 1.0, type STATS_REQUEST, length 56, xid 0x0006a958
	version 1.0, type STATS_REQUEST, length 56, xid 0x0006a959
	version 1.0, type STATS_REQUEST, length 56, xid 0x0006a95a
	version 1.0, type STATS_REQUEST, length 56, xid 0x0006a95b
	version 1.0, type STATS_REQUEST, length 56, xid 0x0006a95c
	version 1.0, type STATS_REQUEST, length 56, xid 0x0006a95d
	version 1.0, type STATS_REQUEST, length 56, xid 0x0006a95e
	version 1.0, type STATS_REQUEST, length 56, xid 0x0006a95f
	version 1.0, type STATS_REQUEST, length 56, xid 0x0006a960
	version 1.0, type STATS_REQUEST, length 56, xid 0x0006a961
	version 1.0, type STATS_REQUEST, length 56, xid 0x0006a962
	version 1.0, type STATS_REQUEST, length 56, xid 0x0006a963
	version 1.0, type STATS_REQUEST, length 56, xid 0x0006a964
	version 1.0, type STATS_REQUEST, length 56, xid 0x0006a965 [|openflow]
16:05:25.689643 IP 192.168.10.152.49850 > 192.168.10.145.6633: Flags [P.], seq 17189:18485, ack 5680, win 355, options [nop,nop,TS val 16093599 ecr 252379335], length 1296: OpenFlow
	version 1.0, type STATS_REPLY, length 36, xid 0x0006a910
	version 1.0, type STATS_REPLY, length 36, xid 0x0006a911
	version 1.0, type STATS_REPLY, length 36, xid 0x0006a912
	version 1.0, type STATS_REPLY, length 36, xid 0x0006a913
	version 1.0, type STATS_REPLY, length 36, xid 0x0006a914
	version 1.0, type STATS_REPLY, length 36, xid 0x0006a915
	version 1.0, type STATS_REPLY, length 36, xid 0x0006a916
	version 1.0, type STATS_REPLY, length 36, xid 0x0006a917
	version 1.0, type STATS_REPLY, length 36, xid 0x0006a918
	version 1.0, type STATS_REPLY, length 36, xid 0x0006a919
	version 1.0, type STATS_REPLY, length 36, xid 0x0006a91a
	version 1.0, type STATS_REPLY, length 36, xid 0x0006a91b
	version 1.0, type STATS_REPLY, length 36, xid 0x0006a91c
	version 1.0, type STATS_REPLY, length 36, xid 0x0006a91d
	version 1.0, type STATS_REPLY, length 36, xid 0x0006a91e
	version 1.0, type STATS_REPLY, length 36, xid 0x0006a91f
	version 1.0, type STATS_REPLY, length 36, xid 0x0006a920
	version 1.0, type STATS_REPLY, length 36, xid 0x0006a921
	version 1.0, type STATS_REPLY, length 36, xid 0x0006a922
	version 1.0, type STATS_REPLY, length 36, xid 0x0006a923
	version 1.0, type STATS_REPLY, length 36, xid 0x0006a924
	version 1.0, type STATS_REPLY, length 36, xid 0x0006a925
	version 1.0, type STATS_REPLY, length 36, xid 0x0006a926
	version 1.0, type STATS_REPLY, length 36, xid 0x0006a927
	version 1.0, type STATS_REPLY, length 36, xid 0x0006a928
	version 1.0, type STATS_REPLY, length 36, xid 0x0006a929
	version 1.0, type STATS_REPLY, length 36, xid 0x0006a92a
	version 1.0, type STATS_REPLY, length 36, xid 0x0006a92b
	version 1.0, type STATS_REPLY, length 36, xid 0x0006a92c
	version 1.0, type STATS_REPLY, length 36, xid 0x0006a92d
	version 1.0, type STATS_REPLY, length 36, xid 0x0006a92e
	version 1.0, type STATS_REPLY, length 36, xid 0x0006a92f
	version 1.0, type STATS_REPLY, length 36, xid 0x0006a930
	version 1.0, type STATS_REPLY, length 36, xid 0x0006a931
	version 1.0, type STATS_REPLY, length 36, xid 0x0006a932
	version 1.0, type STATS_REPLY, length 36, xid 0x0006a933
16:05:25.689657 IP 192.168.10.145.6633 > 192.168.10.152.49850: Flags [P.], seq 5680:6864, ack 17189, win 1452, options [nop,nop,TS val 252379335 ecr 16093598], length 1184: OpenFlow
	version unknown (0x00), type 0x00, length 0, xid 0x6300ffff (corrupt)
16:05:25.689663 IP 192.168.10.152.49850 > 192.168.10.145.6633: Flags [P.], seq 18485:18521, ack 5680, win 355, options [nop,nop,TS val 16093599 ecr 252379335], length 36: OpenFlow
	version 1.0, type STATS_REPLY, length 36, xid 0x0006a934
16:05:25.689676 IP 192.168.10.152.49850 > 192.168.10.145.6633: Flags [P.], seq 18521:18557, ack 6864, win 353, options [nop,nop,TS val 16093599 ecr 252379335], length 36: OpenFlow
	version 1.0, type STATS_REPLY, length 36, xid 0x0006a935
16:05:25.689693 IP 192.168.10.152.49850 > 192.168.10.145.6633: Flags [P.], seq 18557:18593, ack 6864, win 353, options [nop,nop,TS val 16093599 ecr 252379335], length 36: OpenFlow
	version 1.0, type STATS_REPLY, length 36, xid 0x0006a936
16:05:25.689707 IP 192.168.10.152.49850 > 192.168.10.145.6633: Flags [P.], seq 18593:18629, ack 6864, win 353, options [nop,nop,TS val 16093599 ecr 252379335], length 36: OpenFlow
	version 1.0, type STATS_REPLY, length 36, xid 0x0006a937
16:05:25.689721 IP 192.168.10.152.49850 > 192.168.10.145.6633: Flags [P.], seq 18629:18665, ack 6864, win 353, options [nop,nop,TS val 16093599 ecr 252379335], length 36: OpenFlow
	version 1.0, type STATS_REPLY, length 36, xid 0x0006a938
16:05:25.689734 IP 192.168.10.152.49850 > 192.168.10.145.6633: Flags [P.], seq 18665:18701, ack 6864, win 353, options [nop,nop,TS val 16093599 ecr 252379335], length 36: OpenFlow
	version 1.0, type STATS_REPLY, length 36, xid 0x0006a939
16:05:25.689748 IP 192.168.10.152.49850 > 192.168.10.145.6633: Flags [P.], seq 18701:18737, ack 6864, win 353, options [nop,nop,TS val 16093599 ecr 252379335], length 36: OpenFlow
	version 1.0, type STATS_REPLY, length 36, xid 0x0006a93a
16:05:25.689762 IP 192.168.10.152.49850 > 192.168.10.145.6633: Flags [P.], seq 18737:18773, ack 6864, win 353, options [nop,nop,TS val 16093599 ecr 252379335], length 36: OpenFlow
	version 1.0, type STATS_REPLY, length 36, xid 0x0006a93b
16:05:25.689776 IP 192.168.10.152.49850 > 192.168.10.145.6633: Flags [P.], seq 18773:18809, ack 6864, win 353, options [nop,nop,TS val 16093599 ecr 252379335], length 36: OpenFlow
	version 1.0, type STATS_REPLY, length 36, xid 0x0006a93c
16:05:25.689790 IP 192.168.10.152.49850 > 192.168.10.145.6633: Flags [P.], seq 18809:18845, ack 6864, win 353, options [nop,nop,TS val 16093599 ecr 252379335], length 36: OpenFlow
	version 1.0, type STATS_REPLY, length 36, xid 0x0006a93d
16:05:25.689803 IP 192.168.10.152.49850 > 192.168.10.145.6633: Flags [P.], seq 18845:18881, ack 6864, win 353, options [nop,nop,TS val 16093599 ecr 252379335], length 36: OpenFlow
	version 1.0, type STATS_REPLY, length 36, xid 0x0006a93e
16:05:25.689816 IP 192.168.10.152.49850 > 192.168.10.145.6633: Flags [P.], seq 18881:18917, ack 6864, win 353, options [nop,nop,TS val 16093599 ecr 252379335], length 36: OpenFlow
	version 1.0, type STATS_REPLY, length 36, xid 0x0006a93f
16:05:25.689830 IP 192.168.10.152.49850 > 192.168.10.145.6633: Flags [P.], seq 18917:18953, ack 6864, win 353, options [nop,nop,TS val 16093599 ecr 252379335], length 36: OpenFlow
	version 1.0, type STATS_REPLY, length 36, xid 0x0006a940
16:05:25.689844 IP 192.168.10.152.49850 > 192.168.10.145.6633: Flags [P.], seq 18953:18989, ack 6864, win 353, options [nop,nop,TS val 16093599 ecr 252379335], length 36: OpenFlow
	version 1.0, type STATS_REPLY, length 36, xid 0x0006a941
16:05:25.690102 IP 192.168.10.145.6633 > 192.168.10.152.49850: Flags [.], seq 6864:9760, ack 18989, win 1438, options [nop,nop,TS val 252379335 ecr 16093599], length 2896: OpenFlow
	version 1.0, type STATS_REQUEST, length 56, xid 0x0006a97b
	version 1.0, type STATS_REQUEST, length 56, xid 0x0006a97c
	version 1.0, type STATS_REQUEST, length 56, xid 0x0006a97d
	version 1.0, type STATS_REQUEST, length 56, xid 0x0006a97e
	version 1.0, type STATS_REQUEST, length 56, xid 0x0006a97f
	version 1.0, type STATS_REQUEST, length 56, xid 0x0006a980
	version 1.0, type STATS_REQUEST, length 56, xid 0x0006a981
	version 1.0, type STATS_REQUEST, length 56, xid 0x0006a982
	version 1.0, type STATS_REQUEST, length 56, xid 0x0006a983
	version 1.0, type STATS_REQUEST, length 56, xid 0x0006a984
	version 1.0, type STATS_REQUEST, length 56, xid 0x0006a986
	version 1.0, type STATS_REQUEST, length 56, xid 0x0006a985
	version 1.0, type STATS_REQUEST, length 56, xid 0x0006a987
	version 1.0, type STATS_REQUEST, length 56, xid 0x0006a988
	version 1.0, type STATS_REQUEST, length 56, xid 0x0006a989
	version 1.0, type STATS_REQUEST, length 56, xid 0x0006a98b
	version 1.0, type STATS_REQUEST, length 56, xid 0x0006a98c
	version 1.0, type STATS_REQUEST, length 56, xid 0x0006a98d
	version 1.0, type STATS_REQUEST, length 56, xid 0x0006a98e
	version 1.0, type STATS_REQUEST, length 56, xid 0x0006a98f
	version 1.0, type STATS_REQUEST, length 56, xid 0x0006a990
	version 1.0, type STATS_REQUEST, length 56, xid 0x0006a991
	version 1.0, type STATS_REQUEST, length 56, xid 0x0006a992
	version 1.0, type STATS_REQUEST, length 56, xid 0x0006a993
	version 1.0, type STATS_REQUEST, length 56, xid 0x0006a994
	version 1.0, type STATS_REQUEST, length 56, xid 0x0006a995
	version 1.0, type STATS_REQUEST, length 56, xid 0x0006a996
	version 1.0, type STATS_REQUEST, length 56, xid 0x0006a997
	version 1.0, type STATS_REQUEST, length 56, xid 0x0006a998
	version 1.0, type STATS_REQUEST, length 56, xid 0x0006a999
	version 1.0, type STATS_REQUEST, length 56, xid 0x0006a99a
	version 1.0, type STATS_REQUEST, length 56, xid 0x0006a99b
	version 1.0, type STATS_REQUEST, length 56, xid 0x0006a99c
	version 1.0, type STATS_REQUEST, length 56, xid 0x0006a99d
	version 1.0, type STATS_REQUEST, length 56, xid 0x0006a99e
	version 1.0, type STATS_REQUEST, length 56, xid 0x0006a99f
	version 1.0, type STATS_REQUEST, length 56, xid 0x0006a9a0
	version 1.0, type STATS_REQUEST, length 56, xid 0x0006a9a1
	version 1.0, type STATS_REQUEST, length 56, xid 0x0006a9a2
	version 1.0, type STATS_REQUEST, length 56, xid 0x0006a9a3
	version 1.0, type STATS_REQUEST, length 56, xid 0x0006a9a4
	version 1.0, type STATS_REQUEST, length 56, xid 0x0006a9a5
	version 1.0, type STATS_REQUEST, length 56, xid 0x0006a9a6
	version 1.0, type STATS_REQUEST, length 56, xid 0x0006a9a7
	version 1.0, type STATS_REQUEST, length 56, xid 0x0006a9a8
	version 1.0, type STATS_REQUEST, length 56, xid 0x0006a9a9
	version 1.0, type STATS_REQUEST, length 56, xid 0x0006a9aa
	version 1.0, type STATS_REQUEST, length 56, xid 0x0006a9ab
	version 1.0, type STATS_REQUEST, length 56, xid 0x0006a9ac
	version 1.0, type STATS_REQUEST, length 56, xid 0x0006a9ad
	version 1.0, type STATS_REQUEST, length 56, xid 0x0006a9ae
	version 1.0, type STATS_REQUEST, length 56, xid 0x0006a9af [|openflow]
16:05:25.690119 IP 192.168.10.152.49850 > 192.168.10.145.6633: Flags [.], seq 18989:20437, ack 9760, win 358, options [nop,nop,TS val 16093599 ecr 252379335], length 1448: OpenFlow
	version 1.0, type STATS_REPLY, length 36, xid 0x0006a942
	version 1.0, type STATS_REPLY, length 36, xid 0x0006a943
	version 1.0, type STATS_REPLY, length 36, xid 0x0006a944
	version 1.0, type STATS_REPLY, length 36, xid 0x0006a945
	version 1.0, type STATS_REPLY, length 36, xid 0x0006a946
	version 1.0, type STATS_REPLY, length 36, xid 0x0006a947
	version 1.0, type STATS_REPLY, length 36, xid 0x0006a948
	version 1.0, type STATS_REPLY, length 36, xid 0x0006a949
	version 1.0, type STATS_REPLY, length 36, xid 0x0006a94a
	version 1.0, type STATS_REPLY, length 36, xid 0x0006a94b
	version 1.0, type STATS_REPLY, length 36, xid 0x0006a94c
	version 1.0, type STATS_REPLY, length 36, xid 0x0006a94d
	version 1.0, type STATS_REPLY, length 36, xid 0x0006a94e
	version 1.0, type STATS_REPLY, length 36, xid 0x0006a94f
	version 1.0, type STATS_REPLY, length 36, xid 0x0006a950
	version 1.0, type STATS_REPLY, length 36, xid 0x0006a951
	version 1.0, type STATS_REPLY, length 36, xid 0x0006a952
	version 1.0, type STATS_REPLY, length 36, xid 0x0006a953
	version 1.0, type STATS_REPLY, length 36, xid 0x0006a954
	version 1.0, type STATS_REPLY, length 36, xid 0x0006a955
	version 1.0, type STATS_REPLY, length 36, xid 0x0006a956
	version 1.0, type STATS_REPLY, length 36, xid 0x0006a957
	version 1.0, type STATS_REPLY, length 36, xid 0x0006a958
	version 1.0, type STATS_REPLY, length 36, xid 0x0006a959
	version 1.0, type STATS_REPLY, length 36, xid 0x0006a95a
	version 1.0, type STATS_REPLY, length 36, xid 0x0006a95b
	version 1.0, type STATS_REPLY, length 36, xid 0x0006a95c
	version 1.0, type STATS_REPLY, length 36, xid 0x0006a95d
	version 1.0, type STATS_REPLY, length 36, xid 0x0006a95e
	version 1.0, type STATS_REPLY, length 36, xid 0x0006a95f
	version 1.0, type STATS_REPLY, length 36, xid 0x0006a960
	version 1.0, type STATS_REPLY, length 36, xid 0x0006a961
	version 1.0, type STATS_REPLY, length 36, xid 0x0006a962
	version 1.0, type STATS_REPLY, length 36, xid 0x0006a963
	version 1.0, type STATS_REPLY, length 36, xid 0x0006a964
	version 1.0, type STATS_REPLY, length 36, xid 0x0006a965
	version 1.0, type STATS_REPLY, length 36, xid 0x0006a966
	version 1.0, type STATS_REPLY, length 36, xid 0x0006a967
	version 1.0, type STATS_REPLY, length 36, xid 0x0006a968
	version 1.0, type STATS_REPLY, length 36, xid 0x0006a969
	version 1.0, type STATS_REPLY, length 36, xid 0x0006a96a [|openflow]
16:05:25.690130 IP 192.168.10.152.49850 > 192.168.10.145.6633: Flags [P.], seq 20437:21041, ack 9760, win 358, options [nop,nop,TS val 16093599 ecr 252379335], length 604: OpenFlow
	version unknown (0x00), type 0x02, length 0, xid 0x00000000 (corrupt)
16:05:25.690134 IP 192.168.10.145.6633 > 192.168.10.152.49850: Flags [.], seq 9760:11208, ack 18989, win 1438, options [nop,nop,TS val 252379335 ecr 16093599], length 1448: OpenFlow
	version unknown (0x00), type 0x00, length 0, xid 0x00000000 (corrupt)
16:05:25.690138 IP 192.168.10.145.6633 > 192.168.10.152.49850: Flags [P.], seq 11208:12016, ack 18989, win 1438, options [nop,nop,TS val 252379335 ecr 16093599], length 808: OpenFlow
	version unknown (0x00), type 0x00, length 0, xid 0x00000000 (corrupt)
16:05:25.690150 IP 192.168.10.152.49850 > 192.168.10.145.6633: Flags [P.], seq 21041:21077, ack 12016, win 354, options [nop,nop,TS val 16093599 ecr 252379335], length 36: OpenFlow
	version 1.0, type STATS_REPLY, length 36, xid 0x0006a97b
16:05:25.690170 IP 192.168.10.152.49850 > 192.168.10.145.6633: Flags [P.], seq 21077:21113, ack 12016, win 354, options [nop,nop,TS val 16093599 ecr 252379335], length 36: OpenFlow
	version 1.0, type STATS_REPLY, length 36, xid 0x0006a97c
16:05:25.690185 IP 192.168.10.152.49850 > 192.168.10.145.6633: Flags [P.], seq 21113:21149, ack 12016, win 354, options [nop,nop,TS val 16093599 ecr 252379335], length 36: OpenFlow
	version 1.0, type STATS_REPLY, length 36, xid 0x0006a97d
16:05:25.690199 IP 192.168.10.152.49850 > 192.168.10.145.6633: Flags [P.], seq 21149:21185, ack 12016, win 354, options [nop,nop,TS val 16093599 ecr 252379335], length 36: OpenFlow
	version 1.0, type STATS_REPLY, length 36, xid 0x0006a97e
16:05:25.690208 IP 192.168.10.152.49850 > 192.168.10.145.6633: Flags [P.], seq 21185:21221, ack 12016, win 354, options [nop,nop,TS val 16093599 ecr 252379335], length 36: OpenFlow
	version 1.0, type STATS_REPLY, length 36, xid 0x0006a97f
16:05:25.690222 IP 192.168.10.152.49850 > 192.168.10.145.6633: Flags [P.], seq 21221:21257, ack 12016, win 354, options [nop,nop,TS val 16093599 ecr 252379335], length 36: OpenFlow
	version 1.0, type STATS_REPLY, length 36, xid 0x0006a980
16:05:25.690231 IP 192.168.10.152.49850 > 192.168.10.145.6633: Flags [P.], seq 21257:21293, ack 12016, win 354, options [nop,nop,TS val 16093599 ecr 252379335], length 36: OpenFlow
	version 1.0, type STATS_REPLY, length 36, xid 0x0006a981
16:05:25.690244 IP 192.168.10.152.49850 > 192.168.10.145.6633: Flags [P.], seq 21293:21329, ack 12016, win 354, options [nop,nop,TS val 16093599 ecr 252379335], length 36: OpenFlow
	version 1.0, type STATS_REPLY, length 36, xid 0x0006a982
16:05:25.690253 IP 192.168.10.152.49850 > 192.168.10.145.6633: Flags [P.], seq 21329:21365, ack 12016, win 354, options [nop,nop,TS val 16093599 ecr 252379335], length 36: OpenFlow
	version 1.0, type STATS_REPLY, length 36, xid 0x0006a983
16:05:25.690266 IP 192.168.10.152.49850 > 192.168.10.145.6633: Flags [P.], seq 21365:21401, ack 12016, win 354, options [nop,nop,TS val 16093599 ecr 252379335], length 36: OpenFlow
	version 1.0, type STATS_REPLY, length 36, xid 0x0006a984
16:05:25.690275 IP 192.168.10.152.49850 > 192.168.10.145.6633: Flags [P.], seq 21401:21437, ack 12016, win 354, options [nop,nop,TS val 16093599 ecr 252379335], length 36: OpenFlow
	version 1.0, type STATS_REPLY, length 36, xid 0x0006a986
16:05:25.690288 IP 192.168.10.152.49850 > 192.168.10.145.6633: Flags [P.], seq 21437:21473, ack 12016, win 354, options [nop,nop,TS val 16093599 ecr 252379335], length 36: OpenFlow
	version 1.0, type STATS_REPLY, length 36, xid 0x0006a985
16:05:25.690297 IP 192.168.10.152.49850 > 192.168.10.145.6633: Flags [P.], seq 21473:21509, ack 12016, win 354, options [nop,nop,TS val 16093599 ecr 252379335], length 36: OpenFlow
	version 1.0, type STATS_REPLY, length 36, xid 0x0006a987
16:05:25.690532 IP 192.168.10.145.6633 > 192.168.10.152.49850: Flags [.], seq 12016:13464, ack 21473, win 1419, options [nop,nop,TS val 252379336 ecr 16093599], length 1448: OpenFlow
	version 1.0, type STATS_REQUEST, length 56, xid 0x0006a9d7
	version 1.0, type STATS_REQUEST, length 56, xid 0x0006a9d8
	version 1.0, type STATS_REQUEST, length 56, xid 0x0006a9d9
	version 1.0, type STATS_REQUEST, length 56, xid 0x0006a9da
	version 1.0, type STATS_REQUEST, length 56, xid 0x0006a9db
	version 1.0, type STATS_REQUEST, length 56, xid 0x0006a9dc
	version 1.0, type STATS_REQUEST, length 56, xid 0x0006a9dd
	version 1.0, type STATS_REQUEST, length 56, xid 0x0006a9de
	version 1.0, type STATS_REQUEST, length 56, xid 0x0006a9df
	version 1.0, type STATS_REQUEST, length 56, xid 0x0006a9e0
	version 1.0, type STATS_REQUEST, length 56, xid 0x0006a9e1
	version 1.0, type STATS_REQUEST, length 56, xid 0x0006a9e2
	version 1.0, type STATS_REQUEST, length 56, xid 0x0006a9e3
	version 1.0, type STATS_REQUEST, length 56, xid 0x0006a9e4
	version 1.0, type STATS_REQUEST, length 56, xid 0x0006a9e5
	version 1.0, type STATS_REQUEST, length 56, xid 0x0006a9e6
	version 1.0, type STATS_REQUEST, length 56, xid 0x0006a9e7
	version 1.0, type STATS_REQUEST, length 56, xid 0x0006a9e8
	version 1.0, type STATS_REQUEST, length 56, xid 0x0006a9e9
	version 1.0, type STATS_REQUEST, length 56, xid 0x0006a9ea
	version 1.0, type STATS_REQUEST, length 56, xid 0x0006a9eb
	version 1.0, type STATS_REQUEST, length 56, xid 0x0006a9ec
	version 1.0, type STATS_REQUEST, length 56, xid 0x0006a9ed
	version 1.0, type STATS_REQUEST, length 56, xid 0x0006a9ee
	version 1.0, type STATS_REQUEST, length 56, xid 0x0006a9f0
	version 1.0, type STATS_REQUEST, length 56, xid 0x0006a9f1 [|openflow]
16:05:25.690537 IP 192.168.10.145.6633 > 192.168.10.152.49850: Flags [P.], seq 13464:14332, ack 21473, win 1419, options [nop,nop,TS val 252379336 ecr 16093599], length 868: OpenFlow
	version unknown (0x00), type 0x00, length 0, xid 0xef00ffff (corrupt)
16:05:25.690546 IP 192.168.10.152.49850 > 192.168.10.145.6633: Flags [.], seq 21509:22957, ack 13464, win 352, options [nop,nop,TS val 16093599 ecr 252379336], length 1448: OpenFlow
	version 1.0, type STATS_REPLY, length 36, xid 0x0006a988
	version 1.0, type STATS_REPLY, length 36, xid 0x0006a989
	version 1.0, type STATS_REPLY, length 36, xid 0x0006a98b
	version 1.0, type STATS_REPLY, length 36, xid 0x0006a98c
	version 1.0, type STATS_REPLY, length 36, xid 0x0006a98d
	version 1.0, type STATS_REPLY, length 36, xid 0x0006a98e
	version 1.0, type STATS_REPLY, length 36, xid 0x0006a98f
	version 1.0, type STATS_REPLY, length 36, xid 0x0006a990
	version 1.0, type STATS_REPLY, length 36, xid 0x0006a991
	version 1.0, type STATS_REPLY, length 36, xid 0x0006a992
	version 1.0, type STATS_REPLY, length 36, xid 0x0006a993
	version 1.0, type STATS_REPLY, length 36, xid 0x0006a994
	version 1.0, type STATS_REPLY, length 36, xid 0x0006a995
	version 1.0, type STATS_REPLY, length 36, xid 0x0006a996
	version 1.0, type STATS_REPLY, length 36, xid 0x0006a997
	version 1.0, type STATS_REPLY, length 36, xid 0x0006a998
	version 1.0, type STATS_REPLY, length 36, xid 0x0006a999
	version 1.0, type STATS_REPLY, length 36, xid 0x0006a99a
	version 1.0, type STATS_REPLY, length 36, xid 0x0006a99b
	version 1.0, type STATS_REPLY, length 36, xid 0x0006a99c
	version 1.0, type STATS_REPLY, length 36, xid 0x0006a99d
	version 1.0, type STATS_REPLY, length 36, xid 0x0006a99e
	version 1.0, type STATS_REPLY, length 36, xid 0x0006a99f
	version 1.0, type STATS_REPLY, length 36, xid 0x0006a9a0
	version 1.0, type STATS_REPLY, length 36, xid 0x0006a9a1
	version 1.0, type STATS_REPLY, length 36, xid 0x0006a9a2
	version 1.0, type STATS_REPLY, length 36, xid 0x0006a9a3
	version 1.0, type STATS_REPLY, length 36, xid 0x0006a9a4
	version 1.0, type STATS_REPLY, length 36, xid 0x0006a9a5
	version 1.0, type STATS_REPLY, length 36, xid 0x0006a9a6
	version 1.0, type STATS_REPLY, length 36, xid 0x0006a9a7
	version 1.0, type STATS_REPLY, length 36, xid 0x0006a9a8
	version 1.0, type STATS_REPLY, length 36, xid 0x0006a9a9
	version 1.0, type STATS_REPLY, length 36, xid 0x0006a9aa
	version 1.0, type STATS_REPLY, length 36, xid 0x0006a9ab
	version 1.0, type STATS_REPLY, length 36, xid 0x0006a9ac
	version 1.0, type STATS_REPLY, length 36, xid 0x0006a9ad
	version 1.0, type STATS_REPLY, length 36, xid 0x0006a9ae
	version 1.0, type STATS_REPLY, length 36, xid 0x0006a9af
	version 1.0, type STATS_REPLY, length 36, xid 0x0006a9b0
	version 1.0, type STATS_REPLY, length 36, xid 0x0006a9b1 [|openflow]
16:05:25.690559 IP 192.168.10.152.49850 > 192.168.10.145.6633: Flags [P.], seq 22957:23453, ack 13464, win 352, options [nop,nop,TS val 16093599 ecr 252379336], length 496: OpenFlow
	version unknown (0x00), type 0x02, length 0, xid 0x00000000 (corrupt)
16:05:25.690571 IP 192.168.10.152.49850 > 192.168.10.145.6633: Flags [P.], seq 23453:23489, ack 14332, win 351, options [nop,nop,TS val 16093599 ecr 252379336], length 36: OpenFlow
	version 1.0, type STATS_REPLY, length 36, xid 0x0006a9be
16:05:25.690586 IP 192.168.10.152.49850 > 192.168.10.145.6633: Flags [P.], seq 23489:23525, ack 14332, win 351, options [nop,nop,TS val 16093599 ecr 252379336], length 36: OpenFlow
	version 1.0, type STATS_REPLY, length 36, xid 0x0006a9bf
16:05:25.690599 IP 192.168.10.152.49850 > 192.168.10.145.6633: Flags [P.], seq 23525:23561, ack 14332, win 351, options [nop,nop,TS val 16093599 ecr 252379336], length 36: OpenFlow
	version 1.0, type STATS_REPLY, length 36, xid 0x0006a9c0
16:05:25.690613 IP 192.168.10.152.49850 > 192.168.10.145.6633: Flags [P.], seq 23561:23597, ack 14332, win 351, options [nop,nop,TS val 16093599 ecr 252379336], length 36: OpenFlow
	version 1.0, type STATS_REPLY, length 36, xid 0x0006a9c1
16:05:25.690626 IP 192.168.10.152.49850 > 192.168.10.145.6633: Flags [P.], seq 23597:23633, ack 14332, win 351, options [nop,nop,TS val 16093599 ecr 252379336], length 36: OpenFlow
	version 1.0, type STATS_REPLY, length 36, xid 0x0006a9c2
16:05:25.690639 IP 192.168.10.152.49850 > 192.168.10.145.6633: Flags [P.], seq 23633:23669, ack 14332, win 351, options [nop,nop,TS val 16093599 ecr 252379336], length 36: OpenFlow
	version 1.0, type STATS_REPLY, length 36, xid 0x0006a9c3
16:05:25.690653 IP 192.168.10.152.49850 > 192.168.10.145.6633: Flags [P.], seq 23669:23705, ack 14332, win 351, options [nop,nop,TS val 16093599 ecr 252379336], length 36: OpenFlow
	version 1.0, type STATS_REPLY, length 36, xid 0x0006a9c4
16:05:25.690666 IP 192.168.10.152.49850 > 192.168.10.145.6633: Flags [P.], seq 23705:23741, ack 14332, win 351, options [nop,nop,TS val 16093599 ecr 252379336], length 36: OpenFlow
	version 1.0, type STATS_REPLY, length 36, xid 0x0006a9c5
16:05:25.690675 IP 192.168.10.152.49850 > 192.168.10.145.6633: Flags [P.], seq 23741:23777, ack 14332, win 351, options [nop,nop,TS val 16093599 ecr 252379336], length 36: OpenFlow
	version 1.0, type STATS_REPLY, length 36, xid 0x0006a9c6
16:05:25.690688 IP 192.168.10.152.49850 > 192.168.10.145.6633: Flags [P.], seq 23777:23813, ack 14332, win 351, options [nop,nop,TS val 16093599 ecr 252379336], length 36: OpenFlow
	version 1.0, type STATS_REPLY, length 36, xid 0x0006a9c7
16:05:25.690697 IP 192.168.10.152.49850 > 192.168.10.145.6633: Flags [P.], seq 23813:23849, ack 14332, win 351, options [nop,nop,TS val 16093599 ecr 252379336], length 36: OpenFlow
	version 1.0, type STATS_REPLY, length 36, xid 0x0006a9c8
16:05:25.690710 IP 192.168.10.152.49850 > 192.168.10.145.6633: Flags [P.], seq 23849:23885, ack 14332, win 351, options [nop,nop,TS val 16093599 ecr 252379336], length 36: OpenFlow
	version 1.0, type STATS_REPLY, length 36, xid 0x0006a9c9
16:05:25.690719 IP 192.168.10.152.49850 > 192.168.10.145.6633: Flags [P.], seq 23885:23921, ack 14332, win 351, options [nop,nop,TS val 16093599 ecr 252379336], length 36: OpenFlow
	version 1.0, type STATS_REPLY, length 36, xid 0x0006a9ca
16:05:25.690957 IP 192.168.10.145.6633 > 192.168.10.152.49850: Flags [.], ack 23921, win 1452, options [nop,nop,TS val 252379336 ecr 16093599], length 0
16:05:25.690970 IP 192.168.10.152.49850 > 192.168.10.145.6633: Flags [.], seq 23921:25369, ack 14332, win 351, options [nop,nop,TS val 16093599 ecr 252379336], length 1448: OpenFlow
	version 1.0, type STATS_REPLY, length 36, xid 0x0006a9cb
	version 1.0, type STATS_REPLY, length 36, xid 0x0006a9cc
	version 1.0, type STATS_REPLY, length 36, xid 0x0006a9cd
	version 1.0, type STATS_REPLY, length 36, xid 0x0006a9ce
	version 1.0, type STATS_REPLY, length 36, xid 0x0006a9cf
	version 1.0, type STATS_REPLY, length 36, xid 0x0006a9d0
	version 1.0, type STATS_REPLY, length 36, xid 0x0006a9d1
	version 1.0, type STATS_REPLY, length 36, xid 0x0006a9d2
	version 1.0, type STATS_REPLY, length 36, xid 0x0006a9d3
	version 1.0, type STATS_REPLY, length 36, xid 0x0006a9d4
	version 1.0, type STATS_REPLY, length 36, xid 0x0006a9d5
	version 1.0, type STATS_REPLY, length 36, xid 0x0006a9d6
	version 1.0, type STATS_REPLY, length 36, xid 0x0006a9d7
	version 1.0, type STATS_REPLY, length 36, xid 0x0006a9d8
	version 1.0, type STATS_REPLY, length 36, xid 0x0006a9d9
	version 1.0, type STATS_REPLY, length 36, xid 0x0006a9da
	version 1.0, type STATS_REPLY, length 36, xid 0x0006a9db
	version 1.0, type STATS_REPLY, length 36, xid 0x0006a9dc
	version 1.0, type STATS_REPLY, length 36, xid 0x0006a9dd
	version 1.0, type STATS_REPLY, length 36, xid 0x0006a9de
	version 1.0, type STATS_REPLY, length 36, xid 0x0006a9df
	version 1.0, type STATS_REPLY, length 36, xid 0x0006a9e0
	version 1.0, type STATS_REPLY, length 36, xid 0x0006a9e1
	version 1.0, type STATS_REPLY, length 36, xid 0x0006a9e2
	version 1.0, type STATS_REPLY, length 36, xid 0x0006a9e3
	version 1.0, type STATS_REPLY, length 36, xid 0x0006a9e4
	version 1.0, type STATS_REPLY, length 36, xid 0x0006a9e5
	version 1.0, type STATS_REPLY, length 36, xid 0x0006a9e6
	version 1.0, type STATS_REPLY, length 36, xid 0x0006a9e7
	version 1.0, type STATS_REPLY, length 36, xid 0x0006a9e8
	version 1.0, type STATS_REPLY, length 36, xid 0x0006a9e9
	version 1.0, type STATS_REPLY, length 36, xid 0x0006a9ea
	version 1.0, type STATS_REPLY, length 36, xid 0x0006a9eb
	version 1.0, type STATS_REPLY, length 36, xid 0x0006a9ec
	version 1.0, type STATS_REPLY, length 36, xid 0x0006a9ed
	version 1.0, type STATS_REPLY, length 36, xid 0x0006a9ee
	version 1.0, type STATS_REPLY, length 36, xid 0x0006a9f0
	version 1.0, type STATS_REPLY, length 36, xid 0x0006a9f1
	version 1.0, type STATS_REPLY, length 36, xid 0x0006a9f2
	version 1.0, type STATS_REPLY, length 36, xid 0x0006a9f3
	version 1.0, type STATS_REPLY, length 36, xid 0x0006a9f4 [|openflow]
16:05:25.690982 IP 192.168.10.152.49850 > 192.168.10.145.6633: Flags [P.], seq 25369:25793, ack 14332, win 351, options [nop,nop,TS val 16093599 ecr 252379336], length 424: OpenFlow
	version unknown (0x00), type 0x02, length 0, xid 0x00000000 (corrupt)
16:05:25.691154 IP 192.168.10.152.49850 > 192.168.10.145.6633: Flags [P.], seq 25793:26117, ack 14332, win 351, options [nop,nop,TS val 16093599 ecr 252379336], length 324: OpenFlow
	version 1.0, type STATS_REPLY, length 324, xid 0x0006aa00
16:05:25.691199 IP 192.168.10.152.49850 > 192.168.10.145.6633: Flags [P.], seq 26117:26153, ack 14332, win 361, options [nop,nop,TS val 16093599 ecr 252379336], length 36: OpenFlow
	version 1.0, type STATS_REPLY, length 36, xid 0x0006a9ef
16:05:25.691266 IP 192.168.10.145.6633 > 192.168.10.152.49850: Flags [.], ack 26117, win 1452, options [nop,nop,TS val 252379336 ecr 16093599], length 0
16:05:25.730342 IP 192.168.10.145.6633 > 192.168.10.152.49850: Flags [.], ack 26153, win 1452, options [nop,nop,TS val 252379346 ecr 16093599], length 0
16:05:25.771786 IP 192.168.10.145.6633 > 192.168.10.152.49850: Flags [P.], seq 14332:14352, ack 26153, win 1452, options [nop,nop,TS val 252379356 ecr 16093599], length 20: OpenFlow
